{"schema_version":"1.0.0","timestamp":"2026-09-22T09:00:00Z","timestamp_domain":"utc","status":"unavailable","tracking_state":"not_available","confidence":null,"coordinate_convention":"packscan_right_handed_x_right_y_up_z_forward","basis_conversion":"arkit_camera_neg_z_to_packscan_pos_z_reflection_v1","translation_unit":"metres","provenance":{"source":"ARKit","source_version":"6.0"}}
